{
  "schema_version": 1,
  "integration_id": "bannerlord",
  "release_version": "0.1.3",
  "runtime": {
    "manifest_version": "0.1.3",
    "core_api_version": "\u003E=1.0.0,\u003C2.0.0"
  },
  "game": {
    "id": "bannerlord",
    "display_name": "Mount \u0026 Blade II: Bannerlord",
    "supported_versions": [
      "1.4"
    ],
    "process_names": [
      "Bannerlord",
      "TaleWorlds.MountAndBlade.Launcher"
    ],
    "version": {
      "kind": "text_file",
      "path": "bin/Win64_Shipping_Client/Version.xml",
      "compatibility_pattern": "Value=\u0022v(\\d\u002B\\.\\d\u002B)\\.\\d\u002B\u0022"
    },
    "detection": [
      {
        "kind": "steam",
        "app_id": 261550,
        "install_dir": "Mount \u0026 Blade II Bannerlord"
      },
      {
        "kind": "manual",
        "required_paths": [
          "bin/Win64_Shipping_Client/Version.xml",
          "Modules/Native/SubModule.xml"
        ]
      }
    ]
  },
  "prerequisites": [
    {
      "id": "windows_x64",
      "kind": "os",
      "requirement": "Windows x64",
      "required": true
    },
    {
      "id": "bannerlord_installed",
      "kind": "game",
      "requirement": "Mount \u0026 Blade II: Bannerlord 1.4",
      "required": true
    },
    {
      "id": "harmony_installed",
      "kind": "game_mod",
      "requirement": "Bannerlord.Harmony",
      "required": true
    }
  ],
  "artifacts": [
    {
      "id": "bannerlordlink_mod",
      "source": {
        "kind": "https",
        "url": "https://shedoy23.ru/releases/BannerlordLink-0.1.3.zip"
      },
      "size_bytes": 222359,
      "sha256": "54ba23556b4c9a796fd0efb37789d879d0484c710ae70cc559669265ce4d2bf7",
      "format": "zip",
      "archive_root": "Shedoy23.BannerlordLink",
      "signature": {
        "algorithm": "rsa-pss-sha256",
        "key_id": "shedlink-release-2026",
        "value": "J8Shwmsz2nDKzhSzoBQTw2YdXeHuxA8FnF9Jow57pEzDBepQvjWCyfKW1lIoKejuBgU/R1nf5HYMNZUZcSrgQckUOimhaSIqMLX5bcO7y\u002B77rMOlvwM2aTkMt18iSWsr8MFMOgbeqeMkjJNJW4p1/zLNAbl/NbvJypDt/MEi3Xi3\u002BBhOFGWKG7j6W22Nx6ITJ1lZD3PaCFNJ9cAUPYoXEq6Aiq0Kj/wKbJpOI93PDn2urLEAqul9PEwVdGA8Nlszea3Xv/g\u002BKXMq9C6YkYklnU9wMSCSUfZIZDdjUklb8Dy5AvPRAT158ExM5FjkOAEsn3QIiSxpqq4i1k5dRSKcc0lhxrz1T6Qb0UfQ5g25eb1w7qZFcAsUWu5Z7z0NWbK9E\u002BwqG0jKX6kki6ltcJmdShk3uGDBc0qY2UdkeCJiVVFmmd/vpyNCFk\u002Bua0WrziMr9nboRcEDh3E1GKRzG2\u002BqObTRIFX06wcRVmldDIhSI8Nu8o8ZglT\u002BeRhwRJ07fJH7MDYb9C4FEFyyJwvAss/79icsElrtTnE4P8jLk\u002B4aVoqUzAp685fjENpcd4abRA0IuuT0fiDStrRkSm1nNXE7aeSniNswFBKsvm6lQ3W9jCZAKD53la/Ycn9W5d5KFHXkUu5CWVDdiL0pQWBcC4rl\u002BdsthlMzzJ0dCedXQBHFTKU="
      }
    }
  ],
  "installation": {
    "target": {
      "base": "game_root",
      "relative_path": "Modules/Shedoy23.BannerlordLink"
    },
    "staging": {
      "base": "manager_temp",
      "verify_before_replace": true
    },
    "replace": {
      "mode": "atomic_directory_swap",
      "require_game_stopped": true
    },
    "rollback": {
      "enabled": true,
      "preserve": [
        "configuration_store",
        "outcome_journal"
      ]
    },
    "update": {
      "mode": "verify_then_replace",
      "preserve": [
        "configuration_store",
        "outcome_journal"
      ]
    },
    "repair": {
      "mode": "verify_then_replace",
      "preserve": [
        "configuration_store",
        "outcome_journal"
      ]
    },
    "uninstall": {
      "enabled": true,
      "preserve": [
        "configuration_store",
        "outcome_journal"
      ]
    }
  },
  "configuration": {
    "store": {
      "kind": "json",
      "base": "game_root",
      "relative_path": "Modules/Shedoy23.BannerlordLink/config.json"
    },
    "create_if_missing": true,
    "preserve_unmanaged": true,
    "managed_fields": [
      {
        "name": "backend_url",
        "selector": "/backend_url",
        "value_source": "backend_url",
        "secret": false
      },
      {
        "name": "module_token",
        "selector": "/module_token",
        "value_source": "channel_module_token",
        "secret": true
      },
      {
        "name": "channel_id",
        "selector": "/channel_id",
        "value_source": "channel_id",
        "secret": false
      }
    ]
  },
  "health": [
    {
      "id": "assembly_present",
      "kind": "path_exists",
      "path": "bin/Win64_Shipping_Client/BannerlordLink.dll",
      "required": true
    },
    {
      "id": "submodule_present",
      "kind": "path_exists",
      "path": "SubModule.xml",
      "required": true
    }
  ],
  "compatibility_messages": {
    "invalid_game_path": "\u0412 \u0443\u043A\u0430\u0437\u0430\u043D\u043D\u043E\u0439 \u043F\u0430\u043F\u043A\u0435 \u043D\u0435 \u043D\u0430\u0439\u0434\u0435\u043D\u044B bin/Win64_Shipping_Client/Version.xml \u0438 Modules/Native.",
    "unsupported_game_version": "\u042D\u0442\u0430 \u0432\u0435\u0440\u0441\u0438\u044F BannerlordLink \u0441\u043E\u0431\u0440\u0430\u043D\u0430 \u043F\u043E\u0434 Bannerlord 1.4. \u0414\u043B\u044F 1.3 \u0438\u0441\u043F\u043E\u043B\u044C\u0437\u0443\u0439\u0442\u0435 \u0432\u044B\u043F\u0443\u0441\u043A 0.1.1.",
    "game_running": "\u0417\u0430\u043A\u0440\u043E\u0439\u0442\u0435 Bannerlord: \u0438\u0433\u0440\u0430 \u0434\u0435\u0440\u0436\u0438\u0442 \u0444\u0430\u0439\u043B \u043C\u043E\u0434\u0430, \u0438 \u0443\u0441\u0442\u0430\u043D\u043E\u0432\u043A\u0430 \u043D\u0435 \u0441\u043C\u043E\u0436\u0435\u0442 \u0435\u0433\u043E \u0437\u0430\u043C\u0435\u043D\u0438\u0442\u044C."
  },
  "security": {
    "publisher": "shedoy23",
    "signature_status": "signed",
    "allowed_write_roots": [
      "game_root",
      "manager_temp"
    ],
    "redact_fields": [
      "module_token",
      "authorization",
      "cookie"
    ]
  }
}
